{
  "$schema": "https://json-schema.org/draft/2020-12/schema",
  "$id": "urn:openmasu:schema:raw-record:v0.4",
  "title": "OpenMasu Raw Record v0.4",
  "type": "object",
  "additionalProperties": false,
  "required": [
    "contract_version", "record_id", "tenant_id", "app_id", "producer", "producer_version",
    "event_id", "delivery_id", "event_name", "schema_version", "payload_sha256",
    "occurred_at", "occurred_at_source", "received_at", "payload_lifecycle_status",
    "raw_payload_ref", "consent_evaluation_policy_version", "consent_decision_reason_code"
  ],
  "properties": {
    "contract_version": { "const": "0.4.0" },
    "record_id": { "$ref": "common.schema.json#/$defs/id" },
    "tenant_id": { "$ref": "common.schema.json#/$defs/id" },
    "app_id": { "$ref": "common.schema.json#/$defs/id" },
    "producer": { "type": "string", "pattern": "^(sdk-android|sdk-ios|redirector|import:[a-z0-9-]+|adapter:[a-z0-9-]+|postback:[a-z0-9-]+)$" },
    "producer_version": { "type": "string", "minLength": 1 },
    "producer_variant": { "type": "string", "minLength": 1, "maxLength": 64 },
    "wrapper_version": { "type": "string", "minLength": 1, "maxLength": 128 },
    "event_id": { "$ref": "common.schema.json#/$defs/id" },
    "delivery_id": { "$ref": "common.schema.json#/$defs/id" },
    "event_name": { "enum": ["click", "install", "session_start", "ad_impression", "ad_view", "ad_revenue", "purchase", "refund", "consent_changed", "custom_event", "skan_postback", "adattributionkit_postback"] },
    "schema_version": { "const": "0.4.0" },
    "payload_sha256": { "type": "string", "pattern": "^[a-f0-9]{64}$" },
    "occurred_at": { "$ref": "common.schema.json#/$defs/dateTime" },
    "occurred_at_source": { "enum": ["device", "server", "import"] },
    "received_at": { "$ref": "common.schema.json#/$defs/dateTime" },
    "payload_lifecycle_status": { "enum": ["available", "redacted", "purged"] },
    "raw_payload_ref": { "type": "string", "minLength": 1 },
    "integrity_verdict": { "$ref": "common.schema.json#/$defs/integrityVerdict" },
    "processing_purpose_id": { "$ref": "common.schema.json#/$defs/processingPurposeId" },
    "consent_evaluation_policy_version": { "type": "string", "minLength": 1 },
    "consent_decision_reason_code": { "enum": ["consent_not_required", "consent_valid_before_withdrawal", "documented_alternative_legal_basis", "consent_withdrawn"] },
    "withdrawal_recognized_at": { "$ref": "common.schema.json#/$defs/dateTime" },
    "alternative_legal_basis_id": { "$ref": "common.schema.json#/$defs/id" },
    "alternative_legal_basis_policy_version": { "type": "string", "minLength": 1 }
  }
}
