[
  {
    "contract_version": "0.4.0",
    "record_id": "install-37",
    "tenant_id": "tenant-a",
    "app_id": "app-a",
    "producer": "sdk-android",
    "producer_version": "fixture-v0.2.1",
    "event_id": "event:install-37",
    "delivery_id": "delivery:install-37",
    "event_name": "install",
    "schema_version": "0.4.0",
    "payload_sha256": "d1ce11bc481c943bb4d682de41677b949688f26bc68c49f4cd84a20d19f8afe8",
    "occurred_at": "2026-08-19T00:00:00.000Z",
    "occurred_at_source": "device",
    "received_at": "2026-08-19T00:00:01.000Z",
    "payload_lifecycle_status": "available",
    "raw_payload_ref": "protected:install-37",
    "processing_purpose_id": "analytics",
    "consent_evaluation_policy_version": "consent-v0.2.1",
    "consent_decision_reason_code": "consent_not_required"
  }
]
