[
  {
    "contract_version": "0.4.0",
    "record_id": "skew-exact",
    "tenant_id": "tenant-a",
    "app_id": "app-a",
    "producer": "sdk-android",
    "producer_version": "fixture-v0.1",
    "event_id": "event:skew-exact",
    "delivery_id": "delivery:skew-exact",
    "event_name": "session_start",
    "schema_version": "0.4.0",
    "payload_sha256": "da05052fe407d1a5717def83520bbd679c6dd5d71a14bfb664d20957a980f59a",
    "occurred_at": "2026-08-12T00:05:00.000Z",
    "occurred_at_source": "device",
    "received_at": "2026-08-12T00:00:00.000Z",
    "payload_lifecycle_status": "available",
    "raw_payload_ref": "protected:skew-exact",
    "processing_purpose_id": "analytics",
    "consent_evaluation_policy_version": "consent-v0.1",
    "consent_decision_reason_code": "consent_not_required"
  }
]
