[
  {
    "contract_version": "0.4.0",
    "record_id": "click-49",
    "tenant_id": "tenant-a",
    "app_id": "app-a",
    "producer": "redirector",
    "producer_version": "fixture-m6",
    "event_id": "event:click-49",
    "delivery_id": "delivery:click-49",
    "event_name": "click",
    "schema_version": "0.4.0",
    "payload_sha256": "08daba3eba42929ab1390a2678d872b31026dd47625396881302c3f1cd54772e",
    "occurred_at": "2026-08-21T01:00:00.000Z",
    "occurred_at_source": "server",
    "received_at": "2026-08-21T01:00:00.001Z",
    "payload_lifecycle_status": "available",
    "raw_payload_ref": "protected:click-49",
    "processing_purpose_id": "fraud_prevention",
    "consent_evaluation_policy_version": "consent-m6",
    "consent_decision_reason_code": "consent_not_required"
  },
  {
    "contract_version": "0.4.0",
    "record_id": "install-49",
    "tenant_id": "tenant-a",
    "app_id": "app-a",
    "producer": "sdk-android",
    "producer_version": "fixture-m6",
    "event_id": "event:install-49",
    "delivery_id": "delivery:install-49",
    "event_name": "install",
    "schema_version": "0.4.0",
    "payload_sha256": "e4d10386eecc5556b93045069b4780be4d368175c3bdcf6c27e7ec62a5b80c16",
    "occurred_at": "2026-08-21T01:00:10.000Z",
    "occurred_at_source": "device",
    "received_at": "2026-08-21T01:00:10.000Z",
    "payload_lifecycle_status": "available",
    "raw_payload_ref": "protected:install-49",
    "processing_purpose_id": "fraud_prevention",
    "consent_evaluation_policy_version": "consent-m6",
    "consent_decision_reason_code": "consent_not_required"
  }
]
