[
  {
    "contract_version": "0.4.0",
    "record_id": "conflict-first",
    "tenant_id": "tenant-a",
    "app_id": "app-a",
    "producer": "redirector",
    "producer_version": "fixture-v0.1",
    "event_id": "event:conflict-first",
    "delivery_id": "delivery:conflict-first",
    "event_name": "click",
    "schema_version": "0.4.0",
    "payload_sha256": "4c671e2446892cc1461b909b32109854493c4abf4c36ae422968ee55ee5dd0f7",
    "occurred_at": "2026-08-10T00:00:00.000Z",
    "occurred_at_source": "server",
    "received_at": "2026-08-12T00:00:00.000Z",
    "payload_lifecycle_status": "available",
    "raw_payload_ref": "protected:conflict-first",
    "processing_purpose_id": "analytics",
    "consent_evaluation_policy_version": "consent-v0.1",
    "consent_decision_reason_code": "consent_not_required"
  },
  {
    "contract_version": "0.4.0",
    "record_id": "conflict-second",
    "tenant_id": "tenant-a",
    "app_id": "app-a",
    "producer": "redirector",
    "producer_version": "fixture-v0.1",
    "event_id": "event:conflict-first",
    "delivery_id": "delivery:conflict-second",
    "event_name": "click",
    "schema_version": "0.4.0",
    "payload_sha256": "f8a30fa258371078547f62f362c90821670992864a852545119ec08bb7fb5325",
    "occurred_at": "2026-08-10T00:00:00.000Z",
    "occurred_at_source": "server",
    "received_at": "2026-08-12T00:00:00.000Z",
    "payload_lifecycle_status": "available",
    "raw_payload_ref": "protected:conflict-second",
    "processing_purpose_id": "analytics",
    "consent_evaluation_policy_version": "consent-v0.1",
    "consent_decision_reason_code": "consent_not_required"
  }
]
