[
  {
    "contract_version": "0.4.0",
    "record_id": "install-unavailable",
    "tenant_id": "tenant-a",
    "app_id": "app-a",
    "producer": "sdk-android",
    "producer_version": "fixture-v0.1",
    "event_id": "event:install-unavailable",
    "delivery_id": "delivery:install-unavailable",
    "event_name": "install",
    "schema_version": "0.4.0",
    "payload_sha256": "4fec7f1c948a11c598e936cc4c8c447cc68115f3f43d941585945eaee8bf86b1",
    "occurred_at": "2026-08-12T00:00:00.000Z",
    "occurred_at_source": "device",
    "received_at": "2026-08-12T00:00:00.000Z",
    "payload_lifecycle_status": "available",
    "raw_payload_ref": "protected:install-unavailable",
    "processing_purpose_id": "analytics",
    "consent_evaluation_policy_version": "consent-v0.1",
    "consent_decision_reason_code": "consent_not_required"
  },
  {
    "contract_version": "0.4.0",
    "record_id": "install-unsupported",
    "tenant_id": "tenant-a",
    "app_id": "app-a",
    "producer": "sdk-android",
    "producer_version": "fixture-v0.1",
    "event_id": "event:install-unsupported",
    "delivery_id": "delivery:install-unsupported",
    "event_name": "install",
    "schema_version": "0.4.0",
    "payload_sha256": "4575e26819f3fd7af3640f355dcbec6b1bcd8234b18212a1c55c3db5f39b8873",
    "occurred_at": "2026-08-12T00:00:00.000Z",
    "occurred_at_source": "device",
    "received_at": "2026-08-12T00:00:00.000Z",
    "payload_lifecycle_status": "available",
    "raw_payload_ref": "protected:install-unsupported",
    "processing_purpose_id": "analytics",
    "consent_evaluation_policy_version": "consent-v0.1",
    "consent_decision_reason_code": "consent_not_required"
  }
]
