[
  {
    "contract_version": "0.4.0",
    "record_id": "import-modeled-38",
    "tenant_id": "tenant-a",
    "app_id": "app-a",
    "producer": "import:synthetic-provider",
    "producer_version": "fixture-v0.2.1",
    "event_id": "event:import-modeled-38",
    "delivery_id": "delivery:import-modeled-38",
    "event_name": "install",
    "schema_version": "0.4.0",
    "payload_sha256": "e7c2d77d3a96cd855c3d016b34f275d26d59c12e8881cf1962873c6924bc995f",
    "occurred_at": "2026-08-19T01:00:00.000Z",
    "occurred_at_source": "import",
    "received_at": "2026-08-19T02:00:00.000Z",
    "payload_lifecycle_status": "available",
    "raw_payload_ref": "protected:import-modeled-38",
    "processing_purpose_id": "analytics",
    "consent_evaluation_policy_version": "consent-v0.2.1",
    "consent_decision_reason_code": "consent_not_required"
  }
]
