[
  {
    "contract_version": "0.4.0",
    "record_id": "session-device-35",
    "tenant_id": "tenant-a",
    "app_id": "app-a",
    "producer": "sdk-android",
    "producer_version": "fixture-v0.2",
    "event_id": "event:session-device-35",
    "delivery_id": "delivery:session-device-35",
    "event_name": "session_start",
    "schema_version": "0.4.0",
    "payload_sha256": "8d025426183c495f4ff16403be2329e4b6a454cdc04408ab99cf7c161d06f353",
    "occurred_at": "2026-08-19T00:00:00.000Z",
    "occurred_at_source": "device",
    "received_at": "2026-08-19T00:00:00.000Z",
    "payload_lifecycle_status": "available",
    "raw_payload_ref": "protected:session-device-35",
    "processing_purpose_id": "analytics",
    "consent_evaluation_policy_version": "consent-v0.2",
    "consent_decision_reason_code": "consent_not_required"
  }
]
