[
  {
    "contract_version": "0.4.0",
    "record_id": "custom-a-72",
    "tenant_id": "tenant-a",
    "app_id": "app-a",
    "producer": "sdk-android",
    "producer_version": "fixture-v0.4.25",
    "event_id": "event:custom-a-72",
    "delivery_id": "delivery:custom-a-72",
    "event_name": "custom_event",
    "schema_version": "0.4.0",
    "payload_sha256": "9869451abeb3fff739544b583e7f266458a92d228971fd7b79a17e3904fff293",
    "occurred_at": "2026-08-20T12:01:00.000Z",
    "occurred_at_source": "device",
    "received_at": "2026-08-20T12:01:01.000Z",
    "payload_lifecycle_status": "available",
    "raw_payload_ref": "protected:custom-a-72",
    "processing_purpose_id": "analytics",
    "consent_evaluation_policy_version": "consent-v0.4.25",
    "consent_decision_reason_code": "consent_not_required"
  },
  {
    "contract_version": "0.4.0",
    "record_id": "custom-c-72",
    "tenant_id": "tenant-a",
    "app_id": "app-a",
    "producer": "sdk-android",
    "producer_version": "fixture-v0.4.25",
    "event_id": "event:custom-c-72",
    "delivery_id": "delivery:custom-c-72",
    "event_name": "custom_event",
    "schema_version": "0.4.0",
    "payload_sha256": "bebf13c54ccff8e378e490e02e2a9c0c48cb76173f4a15f225c212215dd33b94",
    "occurred_at": "2026-08-20T12:03:00.000Z",
    "occurred_at_source": "device",
    "received_at": "2026-08-20T12:03:01.000Z",
    "payload_lifecycle_status": "available",
    "raw_payload_ref": "protected:custom-c-72",
    "processing_purpose_id": "analytics",
    "consent_evaluation_policy_version": "consent-v0.4.25",
    "consent_decision_reason_code": "consent_not_required"
  },
  {
    "contract_version": "0.4.0",
    "record_id": "session-a-first-72",
    "tenant_id": "tenant-a",
    "app_id": "app-a",
    "producer": "sdk-android",
    "producer_version": "fixture-v0.4.25",
    "event_id": "event:session-a-first-72",
    "delivery_id": "delivery:session-a-first-72",
    "event_name": "session_start",
    "schema_version": "0.4.0",
    "payload_sha256": "69cbbf223839dc4ea8458135c1743e950f1c375a1a72f5e0789d6a461c259bc5",
    "occurred_at": "2026-08-20T00:00:00.000Z",
    "occurred_at_source": "device",
    "received_at": "2026-08-20T00:00:01.000Z",
    "payload_lifecycle_status": "available",
    "raw_payload_ref": "protected:session-a-first-72",
    "processing_purpose_id": "analytics",
    "consent_evaluation_policy_version": "consent-v0.4.25",
    "consent_decision_reason_code": "consent_not_required"
  },
  {
    "contract_version": "0.4.0",
    "record_id": "session-a-next-72",
    "tenant_id": "tenant-a",
    "app_id": "app-a",
    "producer": "sdk-android",
    "producer_version": "fixture-v0.4.25",
    "event_id": "event:session-a-next-72",
    "delivery_id": "delivery:session-a-next-72",
    "event_name": "session_start",
    "schema_version": "0.4.0",
    "payload_sha256": "d70e08e6d37916dfe083e385bf258497b0c645f4a6c68daa2219095e7c7c2555",
    "occurred_at": "2026-08-21T00:00:00.000Z",
    "occurred_at_source": "device",
    "received_at": "2026-08-21T00:00:00.000Z",
    "payload_lifecycle_status": "available",
    "raw_payload_ref": "protected:session-a-next-72",
    "processing_purpose_id": "analytics",
    "consent_evaluation_policy_version": "consent-v0.4.25",
    "consent_decision_reason_code": "consent_not_required"
  },
  {
    "contract_version": "0.4.0",
    "record_id": "session-a-second-72",
    "tenant_id": "tenant-a",
    "app_id": "app-a",
    "producer": "sdk-android",
    "producer_version": "fixture-v0.4.25",
    "event_id": "event:session-a-second-72",
    "delivery_id": "delivery:session-a-second-72",
    "event_name": "session_start",
    "schema_version": "0.4.0",
    "payload_sha256": "72edbdc1aba14081b0d13e2fac6de801ea1a2c4f1ff02aec919f6e411b0016c9",
    "occurred_at": "2026-08-20T12:00:00.000Z",
    "occurred_at_source": "device",
    "received_at": "2026-08-20T12:00:01.000Z",
    "payload_lifecycle_status": "available",
    "raw_payload_ref": "protected:session-a-second-72",
    "processing_purpose_id": "analytics",
    "consent_evaluation_policy_version": "consent-v0.4.25",
    "consent_decision_reason_code": "consent_not_required"
  },
  {
    "contract_version": "0.4.0",
    "record_id": "session-d-late-72",
    "tenant_id": "tenant-a",
    "app_id": "app-a",
    "producer": "sdk-android",
    "producer_version": "fixture-v0.4.25",
    "event_id": "event:session-d-late-72",
    "delivery_id": "delivery:session-d-late-72",
    "event_name": "session_start",
    "schema_version": "0.4.0",
    "payload_sha256": "cb4f7745c79d83fbadf001e0761442fe8b6766e34cf0b0a4dc8f4aee6e22afeb",
    "occurred_at": "2026-08-20T13:00:00.000Z",
    "occurred_at_source": "device",
    "received_at": "2026-08-22T00:00:00.000Z",
    "payload_lifecycle_status": "available",
    "raw_payload_ref": "protected:session-d-late-72",
    "processing_purpose_id": "analytics",
    "consent_evaluation_policy_version": "consent-v0.4.25",
    "consent_decision_reason_code": "consent_not_required"
  }
]
