[
  {
    "contract_version": "0.4.0",
    "record_id": "window76-1-after",
    "tenant_id": "tenant-a",
    "app_id": "app-a",
    "producer": "sdk-android",
    "producer_version": "fixture-v0.1",
    "event_id": "event:window76-1-after",
    "delivery_id": "delivery:window76-1-after",
    "event_name": "install",
    "schema_version": "0.4.0",
    "payload_sha256": "37cf893251130655bb526fe5e3ecbbb0d844aa8fce21656fd934afc9adb77e4a",
    "occurred_at": "2026-08-02T00:00:00.001Z",
    "occurred_at_source": "device",
    "received_at": "2026-09-02T00:00:00.000Z",
    "payload_lifecycle_status": "available",
    "raw_payload_ref": "protected:window76-1-after",
    "processing_purpose_id": "analytics",
    "consent_evaluation_policy_version": "consent-v0.1",
    "consent_decision_reason_code": "consent_not_required"
  },
  {
    "contract_version": "0.4.0",
    "record_id": "window76-1-before",
    "tenant_id": "tenant-a",
    "app_id": "app-a",
    "producer": "sdk-android",
    "producer_version": "fixture-v0.1",
    "event_id": "event:window76-1-before",
    "delivery_id": "delivery:window76-1-before",
    "event_name": "install",
    "schema_version": "0.4.0",
    "payload_sha256": "0915bc6cb2d2da90a83afebf33e43b2f1801b840795ad83c5a7294b1da7384f4",
    "occurred_at": "2026-08-01T23:59:59.999Z",
    "occurred_at_source": "device",
    "received_at": "2026-09-02T00:00:00.000Z",
    "payload_lifecycle_status": "available",
    "raw_payload_ref": "protected:window76-1-before",
    "processing_purpose_id": "analytics",
    "consent_evaluation_policy_version": "consent-v0.1",
    "consent_decision_reason_code": "consent_not_required"
  },
  {
    "contract_version": "0.4.0",
    "record_id": "window76-1-exact",
    "tenant_id": "tenant-a",
    "app_id": "app-a",
    "producer": "sdk-android",
    "producer_version": "fixture-v0.1",
    "event_id": "event:window76-1-exact",
    "delivery_id": "delivery:window76-1-exact",
    "event_name": "install",
    "schema_version": "0.4.0",
    "payload_sha256": "37c7c80e9ebd43f16224cdc05664a2ae2f8e235f0d5a0a260d718b87431a5c84",
    "occurred_at": "2026-08-02T00:00:00.000Z",
    "occurred_at_source": "device",
    "received_at": "2026-09-02T00:00:00.000Z",
    "payload_lifecycle_status": "available",
    "raw_payload_ref": "protected:window76-1-exact",
    "processing_purpose_id": "analytics",
    "consent_evaluation_policy_version": "consent-v0.1",
    "consent_decision_reason_code": "consent_not_required"
  },
  {
    "contract_version": "0.4.0",
    "record_id": "window76-30-after",
    "tenant_id": "tenant-a",
    "app_id": "app-a",
    "producer": "sdk-android",
    "producer_version": "fixture-v0.1",
    "event_id": "event:window76-30-after",
    "delivery_id": "delivery:window76-30-after",
    "event_name": "install",
    "schema_version": "0.4.0",
    "payload_sha256": "32655384e446cb8f9cafec2d3df334cd17a5ab5cacac117dea5e5d7a19ed5312",
    "occurred_at": "2026-08-31T00:00:00.001Z",
    "occurred_at_source": "device",
    "received_at": "2026-09-02T00:00:00.000Z",
    "payload_lifecycle_status": "available",
    "raw_payload_ref": "protected:window76-30-after",
    "processing_purpose_id": "analytics",
    "consent_evaluation_policy_version": "consent-v0.1",
    "consent_decision_reason_code": "consent_not_required"
  },
  {
    "contract_version": "0.4.0",
    "record_id": "window76-30-before",
    "tenant_id": "tenant-a",
    "app_id": "app-a",
    "producer": "sdk-android",
    "producer_version": "fixture-v0.1",
    "event_id": "event:window76-30-before",
    "delivery_id": "delivery:window76-30-before",
    "event_name": "install",
    "schema_version": "0.4.0",
    "payload_sha256": "9576d80f6a942d035fe486445ef571e75bff9c5a994668136b655067929eb362",
    "occurred_at": "2026-08-30T23:59:59.999Z",
    "occurred_at_source": "device",
    "received_at": "2026-09-02T00:00:00.000Z",
    "payload_lifecycle_status": "available",
    "raw_payload_ref": "protected:window76-30-before",
    "processing_purpose_id": "analytics",
    "consent_evaluation_policy_version": "consent-v0.1",
    "consent_decision_reason_code": "consent_not_required"
  },
  {
    "contract_version": "0.4.0",
    "record_id": "window76-30-exact",
    "tenant_id": "tenant-a",
    "app_id": "app-a",
    "producer": "sdk-android",
    "producer_version": "fixture-v0.1",
    "event_id": "event:window76-30-exact",
    "delivery_id": "delivery:window76-30-exact",
    "event_name": "install",
    "schema_version": "0.4.0",
    "payload_sha256": "57da4468255d43e1e7564b5af73caaaafad4eb7d289732e1ccc42e99d61fd756",
    "occurred_at": "2026-08-31T00:00:00.000Z",
    "occurred_at_source": "device",
    "received_at": "2026-09-02T00:00:00.000Z",
    "payload_lifecycle_status": "available",
    "raw_payload_ref": "protected:window76-30-exact",
    "processing_purpose_id": "analytics",
    "consent_evaluation_policy_version": "consent-v0.1",
    "consent_decision_reason_code": "consent_not_required"
  },
  {
    "contract_version": "0.4.0",
    "record_id": "window76-7-after",
    "tenant_id": "tenant-a",
    "app_id": "app-a",
    "producer": "sdk-android",
    "producer_version": "fixture-v0.1",
    "event_id": "event:window76-7-after",
    "delivery_id": "delivery:window76-7-after",
    "event_name": "install",
    "schema_version": "0.4.0",
    "payload_sha256": "41a8ef81296dbc782302fa3dd24927fbdab1936fae0e9a32452f5646f73b11b4",
    "occurred_at": "2026-08-08T00:00:00.001Z",
    "occurred_at_source": "device",
    "received_at": "2026-09-02T00:00:00.000Z",
    "payload_lifecycle_status": "available",
    "raw_payload_ref": "protected:window76-7-after",
    "processing_purpose_id": "analytics",
    "consent_evaluation_policy_version": "consent-v0.1",
    "consent_decision_reason_code": "consent_not_required"
  },
  {
    "contract_version": "0.4.0",
    "record_id": "window76-7-before",
    "tenant_id": "tenant-a",
    "app_id": "app-a",
    "producer": "sdk-android",
    "producer_version": "fixture-v0.1",
    "event_id": "event:window76-7-before",
    "delivery_id": "delivery:window76-7-before",
    "event_name": "install",
    "schema_version": "0.4.0",
    "payload_sha256": "d271e64b289a83d78243026a489d5400827002b63b507ecba4f027f8ec47285a",
    "occurred_at": "2026-08-07T23:59:59.999Z",
    "occurred_at_source": "device",
    "received_at": "2026-09-02T00:00:00.000Z",
    "payload_lifecycle_status": "available",
    "raw_payload_ref": "protected:window76-7-before",
    "processing_purpose_id": "analytics",
    "consent_evaluation_policy_version": "consent-v0.1",
    "consent_decision_reason_code": "consent_not_required"
  },
  {
    "contract_version": "0.4.0",
    "record_id": "window76-7-exact",
    "tenant_id": "tenant-a",
    "app_id": "app-a",
    "producer": "sdk-android",
    "producer_version": "fixture-v0.1",
    "event_id": "event:window76-7-exact",
    "delivery_id": "delivery:window76-7-exact",
    "event_name": "install",
    "schema_version": "0.4.0",
    "payload_sha256": "6b231b0de132cb5f94e29c4a5d21d0466481edf7567fc6592f50a30fb62aa13f",
    "occurred_at": "2026-08-08T00:00:00.000Z",
    "occurred_at_source": "device",
    "received_at": "2026-09-02T00:00:00.000Z",
    "payload_lifecycle_status": "available",
    "raw_payload_ref": "protected:window76-7-exact",
    "processing_purpose_id": "analytics",
    "consent_evaluation_policy_version": "consent-v0.1",
    "consent_decision_reason_code": "consent_not_required"
  },
  {
    "contract_version": "0.4.0",
    "record_id": "window76-click",
    "tenant_id": "tenant-a",
    "app_id": "app-a",
    "producer": "redirector",
    "producer_version": "fixture-v0.1",
    "event_id": "event:window76-click",
    "delivery_id": "delivery:window76-click",
    "event_name": "click",
    "schema_version": "0.4.0",
    "payload_sha256": "5978eb94aef4c73ccffabf6f4642c8f9f3878e8f241e099545ea3393c14d9b28",
    "occurred_at": "2026-08-01T00:00:00.000Z",
    "occurred_at_source": "server",
    "received_at": "2026-09-02T00:00:00.000Z",
    "payload_lifecycle_status": "available",
    "raw_payload_ref": "protected:window76-click",
    "processing_purpose_id": "analytics",
    "consent_evaluation_policy_version": "consent-v0.1",
    "consent_decision_reason_code": "consent_not_required"
  }
]
