[
  {
    "contract_version": "0.4.0",
    "record_id": "ios-conversion-schema-45",
    "tenant_id": "tenant-a",
    "app_id": "app-a",
    "producer": "sdk-ios",
    "producer_version": "0.1.0",
    "event_id": "event:ios-conversion-schema-45",
    "delivery_id": "delivery:ios-conversion-schema-45",
    "event_name": "install",
    "schema_version": "0.4.0",
    "payload_sha256": "3165088f0016e2d7745abfce00a76707c9fb812540dd6e999455e551a3079574",
    "occurred_at": "2026-08-20T12:00:00.000Z",
    "occurred_at_source": "device",
    "received_at": "2026-08-20T12:00:01.000Z",
    "payload_lifecycle_status": "available",
    "raw_payload_ref": "protected:ios-conversion-schema-45",
    "processing_purpose_id": "analytics",
    "consent_evaluation_policy_version": "consent-m4-v0.3.4",
    "consent_decision_reason_code": "consent_not_required"
  },
  {
    "contract_version": "0.4.0",
    "record_id": "ios-conversion-update-45",
    "tenant_id": "tenant-a",
    "app_id": "app-a",
    "producer": "sdk-ios",
    "producer_version": "0.1.0",
    "event_id": "event:ios-conversion-update-45",
    "delivery_id": "delivery:ios-conversion-update-45",
    "event_name": "custom_event",
    "schema_version": "0.4.0",
    "payload_sha256": "b702b0728fbe7d6bf6155c711c515457c27c03e08a9fdd535cb657ed4bf98cba",
    "occurred_at": "2026-08-20T12:05:00.000Z",
    "occurred_at_source": "device",
    "received_at": "2026-08-20T12:05:01.000Z",
    "payload_lifecycle_status": "available",
    "raw_payload_ref": "protected:ios-conversion-update-45",
    "processing_purpose_id": "analytics",
    "consent_evaluation_policy_version": "consent-m4-v0.3.4",
    "consent_decision_reason_code": "consent_not_required"
  }
]
